{
 "id": "feat.don-de-la-vision-verdadera",
 "name": "Don de la visión verdadera",
 "text": "Dote de don épico (requisito: nivel 19 o más)\n\nObtienes los siguientes beneficios:\n\nMejora de característica. Aumenta una puntuación de característica de tu elección en 1, hasta un máximo de 30.\n\nVisión verdadera. Tienes visión verdadera hasta 18 m.",
 "blocks": [
  {
   "type": "subtitle",
   "page": 95,
   "md": "*Dote de don épico (requisito: nivel 19 o más)*",
   "text": "Dote de don épico (requisito: nivel 19 o más)"
  },
  {
   "type": "paragraph",
   "page": 95,
   "md": "Obtienes los siguientes beneficios:",
   "text": "Obtienes los siguientes beneficios:"
  },
  {
   "type": "definition",
   "page": 95,
   "md": "***Mejora de característica.*** Aumenta una puntuación de característica de tu elección en 1, hasta un máximo de 30.",
   "text": "Mejora de característica. Aumenta una puntuación de característica de tu elección en 1, hasta un máximo de 30."
  },
  {
   "type": "definition",
   "page": 95,
   "md": "***Visión verdadera.*** Tienes visión verdadera hasta 18 m.",
   "text": "Visión verdadera. Tienes visión verdadera hasta 18 m."
  }
 ],
 "source": {
  "book": "SRD 5.2.1 es",
  "page": 95
 },
 "category": "Dotes de don épico"
}